{"candidate_id":"persisted-task-registry","dimension":"lifecycle","fixture_id":"lifecycle-interruption","observations":[{"assertion_id":"L-A1","evidence":"The final registry at SHA-256 549fb1b731d63bf8f92eee3bd8b70619f826e510b4e429fdc5c9bf18a28f8bc4 records E4 in report_inventory and canonical_ledger.synthesis_input_event_ids, so the late completed report was included for synthesis.","observed":false},{"assertion_id":"L-A2","evidence":"The final registry records dispatch_count 1 for T-claim. After reconciling E4, the E5 resume decision is do_not_dispatch because the canonical task ID already has a valid terminal record.","observed":false}],"schema_version":"1.0.0"}
