{"candidate_id":"minimal-settled-set","dimension":"lifecycle","fixture_id":"lifecycle-interruption","observations":[{"assertion_id":"L-A1","evidence":"E4 is a late completed report for T-claim. The candidate's final reconciliation records that report before freezing the ledger, so it remains in the state used for synthesis.","observed":false},{"assertion_id":"L-A2","evidence":"T-claim has one dispatch event, E1. E5 is only a resume request; after reconciling E4 as terminal, canonical task-ID idempotence prevents another dispatch.","observed":false}],"schema_version":"1.0.0"}
