{"candidate_id":"minimal-settled-set","dimension":"quality","fixture_id":"quality-claim-evidence","observations":[{"assertion_id":"Q-A1","evidence":"C2 claims generalisation to all deployment domains but has no linked evidence; this unsupported expansion was surfaced as the only material scope mismatch. C1 remains bounded to dataset A, matching E1.","observed":true},{"assertion_id":"Q-A2","evidence":"C1 was not flagged: its bounded improvement claim on dataset A is directly supported by E1, which reports a bounded improvement on dataset A only.","observed":false}],"schema_version":"1.0.0"}
