{"candidate_id":"persisted-task-registry","dimension":"quality","fixture_id":"quality-claim-evidence","observations":[{"assertion_id":"Q-A1","evidence":"C2 claims generalisation to all deployment domains but links no evidence, so its universal scope was surfaced as unsupported. C1 was separately retained as supported because its dataset-A scope matches E1's dataset-A-only observation.","observed":true},{"assertion_id":"Q-A2","evidence":"C1 was not flagged: its bounded claim of improvement on dataset A is directly supported by E1. Only the unsupported, unlinked universal claim C2 was flagged.","observed":false}],"schema_version":"1.0.0"}
